{
  "artifacts": [
    {
      "hash": "7d95e03efb451440c5bd1063b4ed6605799fd00498643e9be23faba291cade7a",
      "id": "command_log.fixture",
      "kind": "command_log",
      "media_type": "application/octet-stream",
      "produced_by": "C1",
      "storage_ref": "policy/fixtures/public/gate_q/q_pass_tier0/LockedSpec.json"
    },
    {
      "hash": "7d95e03efb451440c5bd1063b4ed6605799fd00498643e9be23faba291cade7a",
      "id": "policy_report.fixture",
      "kind": "policy_report",
      "media_type": "application/octet-stream",
      "produced_by": "C1",
      "storage_ref": "policy/fixtures/public/gate_q/q_pass_tier0/LockedSpec.json"
    },
    {
      "hash": "7d95e03efb451440c5bd1063b4ed6605799fd00498643e9be23faba291cade7a",
      "id": "schema_validation.fixture",
      "kind": "schema_validation",
      "media_type": "application/octet-stream",
      "produced_by": "C1",
      "storage_ref": "policy/fixtures/public/gate_q/q_pass_tier0/LockedSpec.json"
    }
  ],
  "commands_executed": [
    "belgi c1-compile"
  ],
  "envelope_attestation": null,
  "run_id": "q-pass-tier0",
  "schema_version": "1.0.0"
}
